{
  "companies": [
    {
      "classificationHistory": [
        {
          "industryCode": "COAL",
          "modelFamily": "ENERGY_COAL",
          "observedAt": "2026-07-30",
          "sectorCode": "ENERGY"
        }
      ],
      "coverageStatus": "FINANCIALS",
      "firstSeenAt": "2026-07-30",
      "inIdx30": true,
      "industryCode": "COAL",
      "industryName": "Coal",
      "lastSeenAt": "2026-07-30",
      "legalName": null,
      "listingIdentity": null,
      "modelFamily": "ENERGY_COAL",
      "name": "Alamtri Resources Indonesia Tbk",
      "nameHistory": [
        {
          "name": "Alamtri Resources Indonesia Tbk",
          "observedAt": "2026-07-30"
        }
      ],
      "reportingCurrency": null,
      "sectorCode": "ENERGY",
      "sectorName": "Energy",
      "sourceRef": "fixture:2026-02-02:ADRO",
      "ticker": "ADRO"
    },
    {
      "classificationHistory": [
        {
          "industryCode": "METALS_AND_MINERALS",
          "modelFamily": "MINER",
          "observedAt": "2026-07-30",
          "sectorCode": "BASIC_MATERIALS"
        }
      ],
      "coverageStatus": "FINANCIALS",
      "firstSeenAt": "2026-07-30",
      "inIdx30": true,
      "industryCode": "METALS_AND_MINERALS",
      "industryName": "Metals and Minerals",
      "lastSeenAt": "2026-07-30",
      "legalName": null,
      "listingIdentity": null,
      "modelFamily": "MINER",
      "name": "Amman Mineral Internasional Tbk",
      "nameHistory": [
        {
          "name": "Amman Mineral Internasional Tbk",
          "observedAt": "2026-07-30"
        }
      ],
      "reportingCurrency": null,
      "sectorCode": "BASIC_MATERIALS",
      "sectorName": "Basic Materials",
      "sourceRef": "fixture:2026-02-02:AMMN",
      "ticker": "AMMN"
    },
    {
      "classificationHistory": [
        {
          "industryCode": "RETAIL_STAPLES",
          "modelFamily": "CONSUMER_STAPLES",
          "observedAt": "2026-07-30",
          "sectorCode": "CONSUMER_NON_CYCLICALS"
        }
      ],
      "coverageStatus": "FINANCIALS",
      "firstSeenAt": "2026-07-30",
      "inIdx30": true,
      "industryCode": "RETAIL_STAPLES",
      "industryName": "Retail - Staples",
      "lastSeenAt": "2026-07-30",
      "legalName": null,
      "listingIdentity": null,
      "modelFamily": "CONSUMER_STAPLES",
      "name": "Sumber Alfaria Trijaya Tbk",
      "nameHistory": [
        {
          "name": "Sumber Alfaria Trijaya Tbk",
          "observedAt": "2026-07-30"
        }
      ],
      "reportingCurrency": null,
      "sectorCode": "CONSUMER_NON_CYCLICALS",
      "sectorName": "Consumer Non-Cyclicals",
      "sourceRef": "fixture:2026-02-02:AMRT",
      "ticker": "AMRT"
    },
    {
      "classificationHistory": [
        {
          "industryCode": "METALS_AND_MINERALS",
          "modelFamily": "MINER",
          "observedAt": "2026-07-30",
          "sectorCode": "BASIC_MATERIALS"
        }
      ],
      "coverageStatus": "FINANCIALS",
      "firstSeenAt": "2026-07-30",
      "inIdx30": true,
      "industryCode": "METALS_AND_MINERALS",
      "industryName": "Metals and Minerals",
      "lastSeenAt": "2026-07-30",
      "legalName": null,
      "listingIdentity": null,
      "modelFamily": "MINER",
      "name": "Aneka Tambang Tbk",
      "nameHistory": [
        {
          "name": "Aneka Tambang Tbk",
          "observedAt": "2026-07-30"
        }
      ],
      "reportingCurrency": null,
      "sectorCode": "BASIC_MATERIALS",
      "sectorName": "Basic Materials",
      "sourceRef": "fixture:2026-02-02:ANTM",
      "ticker": "ANTM"
    },
    {
      "classificationHistory": [
        {
          "industryCode": "INDUSTRIAL_CONGLOMERATES",
          "modelFamily": "CONGLOMERATE",
          "observedAt": "2026-07-30",
          "sectorCode": "INDUSTRIALS"
        }
      ],
      "coverageStatus": "FINANCIALS",
      "firstSeenAt": "2026-07-30",
      "inIdx30": true,
      "industryCode": "INDUSTRIAL_CONGLOMERATES",
      "industryName": "Industrial Conglomerates",
      "lastSeenAt": "2026-07-30",
      "legalName": null,
      "listingIdentity": null,
      "modelFamily": "CONGLOMERATE",
      "name": "Astra International Tbk",
      "nameHistory": [
        {
          "name": "Astra International Tbk",
          "observedAt": "2026-07-30"
        }
      ],
      "reportingCurrency": null,
      "sectorCode": "INDUSTRIALS",
      "sectorName": "Industrials",
      "sourceRef": "fixture:2026-02-02:ASII",
      "ticker": "ASII"
    },
    {
      "classificationHistory": [
        {
          "industryCode": "BANKS",
          "modelFamily": "BANK",
          "observedAt": "2026-07-30",
          "sectorCode": "FINANCIALS"
        }
      ],
      "coverageStatus": "FINANCIALS",
      "firstSeenAt": "2026-07-30",
      "inIdx30": true,
      "industryCode": "BANKS",
      "industryName": "Banks",
      "lastSeenAt": "2026-07-30",
      "legalName": null,
      "listingIdentity": null,
      "modelFamily": "BANK",
      "name": "Bank Central Asia Tbk",
      "nameHistory": [
        {
          "name": "Bank Central Asia Tbk",
          "observedAt": "2026-07-30"
        }
      ],
      "reportingCurrency": null,
      "sectorCode": "FINANCIALS",
      "sectorName": "Financials",
      "sourceRef": "fixture:2026-02-02:BBCA",
      "ticker": "BBCA"
    },
    {
      "classificationHistory": [
        {
          "industryCode": "BANKS",
          "modelFamily": "BANK",
          "observedAt": "2026-07-30",
          "sectorCode": "FINANCIALS"
        }
      ],
      "coverageStatus": "FINANCIALS",
      "firstSeenAt": "2026-07-30",
      "inIdx30": true,
      "industryCode": "BANKS",
      "industryName": "Banks",
      "lastSeenAt": "2026-07-30",
      "legalName": null,
      "listingIdentity": null,
      "modelFamily": "BANK",
      "name": "Bank Negara Indonesia (Persero) Tbk",
      "nameHistory": [
        {
          "name": "Bank Negara Indonesia (Persero) Tbk",
          "observedAt": "2026-07-30"
        }
      ],
      "reportingCurrency": null,
      "sectorCode": "FINANCIALS",
      "sectorName": "Financials",
      "sourceRef": "fixture:2026-02-02:BBNI",
      "ticker": "BBNI"
    },
    {
      "classificationHistory": [
        {
          "industryCode": "BANKS",
          "modelFamily": "BANK",
          "observedAt": "2026-07-30",
          "sectorCode": "FINANCIALS"
        }
      ],
      "coverageStatus": "FINANCIALS",
      "firstSeenAt": "2026-07-30",
      "inIdx30": true,
      "industryCode": "BANKS",
      "industryName": "Banks",
      "lastSeenAt": "2026-07-30",
      "legalName": null,
      "listingIdentity": null,
      "modelFamily": "BANK",
      "name": "Bank Rakyat Indonesia (Persero) Tbk",
      "nameHistory": [
        {
          "name": "Bank Rakyat Indonesia (Persero) Tbk",
          "observedAt": "2026-07-30"
        }
      ],
      "reportingCurrency": null,
      "sectorCode": "FINANCIALS",
      "sectorName": "Financials",
      "sourceRef": "fixture:2026-02-02:BBRI",
      "ticker": "BBRI"
    },
    {
      "classificationHistory": [
        {
          "industryCode": "BANKS",
          "modelFamily": "BANK",
          "observedAt": "2026-07-30",
          "sectorCode": "FINANCIALS"
        }
      ],
      "coverageStatus": "FINANCIALS",
      "firstSeenAt": "2026-07-30",
      "inIdx30": true,
      "industryCode": "BANKS",
      "industryName": "Banks",
      "lastSeenAt": "2026-07-30",
      "legalName": null,
      "listingIdentity": null,
      "modelFamily": "BANK",
      "name": "Bank Mandiri (Persero) Tbk",
      "nameHistory": [
        {
          "name": "Bank Mandiri (Persero) Tbk",
          "observedAt": "2026-07-30"
        }
      ],
      "reportingCurrency": null,
      "sectorCode": "FINANCIALS",
      "sectorName": "Financials",
      "sourceRef": "fixture:2026-02-02:BMRI",
      "ticker": "BMRI"
    },
    {
      "classificationHistory": [
        {
          "industryCode": "BANKS",
          "modelFamily": "BANK",
          "observedAt": "2026-07-30",
          "sectorCode": "FINANCIALS"
        }
      ],
      "coverageStatus": "FINANCIALS",
      "firstSeenAt": "2026-07-30",
      "inIdx30": true,
      "industryCode": "BANKS",
      "industryName": "Banks",
      "lastSeenAt": "2026-07-30",
      "legalName": null,
      "listingIdentity": null,
      "modelFamily": "BANK",
      "name": "Bank Syariah Indonesia Tbk",
      "nameHistory": [
        {
          "name": "Bank Syariah Indonesia Tbk",
          "observedAt": "2026-07-30"
        }
      ],
      "reportingCurrency": null,
      "sectorCode": "FINANCIALS",
      "sectorName": "Financials",
      "sourceRef": "fixture:2026-02-02:BRIS",
      "ticker": "BRIS"
    },
    {
      "classificationHistory": [
        {
          "industryCode": "CHEMICALS",
          "modelFamily": "CHEMICALS",
          "observedAt": "2026-07-30",
          "sectorCode": "BASIC_MATERIALS"
        }
      ],
      "coverageStatus": "FINANCIALS",
      "firstSeenAt": "2026-07-30",
      "inIdx30": true,
      "industryCode": "CHEMICALS",
      "industryName": "Chemicals",
      "lastSeenAt": "2026-07-30",
      "legalName": null,
      "listingIdentity": null,
      "modelFamily": "CHEMICALS",
      "name": "Barito Pacific Tbk",
      "nameHistory": [
        {
          "name": "Barito Pacific Tbk",
          "observedAt": "2026-07-30"
        }
      ],
      "reportingCurrency": null,
      "sectorCode": "BASIC_MATERIALS",
      "sectorName": "Basic Materials",
      "sourceRef": "fixture:2026-02-02:BRPT",
      "ticker": "BRPT"
    },
    {
      "classificationHistory": [
        {
          "industryCode": "ANIMAL_FEED_AND_PROTEIN",
          "modelFamily": "PROTEIN",
          "observedAt": "2026-07-30",
          "sectorCode": "CONSUMER_NON_CYCLICALS"
        }
      ],
      "coverageStatus": "FINANCIALS",
      "firstSeenAt": "2026-07-30",
      "inIdx30": true,